,Unnamed: 0,Translated_Utterance,Emotion
4200,5193,Phoebe क्या बात है,neutral
4201,5194,कुछ भी नहीं मुझे खेद है मैं सिर्फ हूँ मैं किसी तरह से हूँ।,sadness
4202,5196,हे चांदलर कि मेज का स्थान  बजे बंद हो गया।,neutral
4203,5197,ठीक,neutral
4204,5198,क्या है,neutral
4205,5199,सब ठीक है आप पाओलो जानते हैं,neutral
4206,5200,मैं अपने काम से परिचित हूं हाँ ,neutral
4207,5202,जोआ कल स्टोर खुल जाएगा,surprise
4208,5203,अधिक कॉफी यहाँ कृपया,joy
4209,5204,हे,neutral
4210,5205,हे क्या आप यहाँ क्या कर रहे हैं,surprise
4211,5206,ठीक है मैंने सोचा कि आप क्या कहते हैं और उम मैंने डुह को महसूस किया शायद मैं थोड़ा न्यायिक था।,sadness
4212,5207,हाँ ओह लेकिन ओह ,neutral
4213,5208,अब देखो Phoebe याद है हे उनके सिर्फ अपने क्रिसमस को पूरा करते हैं।,neutral
4214,5209,भाग्य।,neutral
4215,5210,निश्चित,neutral
4216,5211,हाँ।,neutral
4217,5212,ठीक है।,neutral
4218,5213,ओके यिक्स यह क्या है,surprise
4219,5214,ओह कि,neutral
4220,5216,हमें ताजा लोगों के लिए कमरा बनाना होगा।,neutral
4221,5218,ठीक है वे चिप्पर में जाते हैं।,neutral
4222,5219,क्यों नहीं Nooo,fear
4223,5220,हे हे,surprise
4224,5221,प्रकाश अभी भी बाहर,neutral
4225,5222,हाँ।,neutral
4226,5223,Oh शायद वे napping,neutral
4227,5225,शट अप,anger
4228,5226,तो व्हाडिया को लगता है जॉर्ज जैसा है,neutral
4229,5227,मुझे लगता है कि वह शर्मीला है।,neutral
4230,5228,हाँ,surprise
4231,5229,हाँ। मुझे लगता है कि आपको उसे बाहर निकालना है। और फिर जब आप करते हैं तो वह एक शिकारी जानवर है।,neutral
4232,5230,हाय हाय मैं रॉस हूँ तुम मुझे पता नहीं है लेकिन मैं तुम्हारा एक बड़ा प्रशंसक हूँ। मेरा मतलब है,joy
4233,5231,Aren,neutral
4234,5232,खैर हाँ दयालु।,neutral
4235,5233,उम लेकिन कि OKay देखें कि हमारे पास एक समझ है उम हम प्रत्येक के पास पांच प्रसिद्ध लोगों की सूची है इसलिए मुझे आपके साथ सोने की अनुमति है।,neutral
4236,5237,क्या,fear
4237,5238,मेरा मतलब है कि यह जीवन भर के अवसर में एक बार है।,neutral
4238,5239,हाँ तुम्हारे लिए। क्या सूची है,neutral
4239,5240,उम हाँ।,neutral
4240,5241,मैं इसे देख सकता हूँ,neutral
4241,5242,उम नहीं।,fear
4242,5244,लेकिन ठीक है।,neutral
4243,5245,मैं सूची में नहीं हूँ,surprise
4244,5246,उम देखें लेकिन यह नहीं अंतिम ड्राफ्ट।,neutral
4245,5248,Yeah um okay see आप थे आप सूची में थे लेकिन मेरे दोस्त चांदलर ने बहुत अच्छे बिंदु को सामने लाया कि आप अंतरराष्ट्रीय हैं इसलिए मैंने आपको स्थानीय Wynona राइडर के लिए टक्कर दी।,neutral
4246,5249,Yknow it,neutral
4247,5250,क्या,neutral
4248,5251,क्योंकि मेरे पास पांच गौफी कॉफी हाउस लोगों की सूची है और कल मैं वहां उस आदमी के लिए टक्कर लगी हूं।,neutral
4249,5252,हम सिर्फ दोस्त हैं।,neutral
4250,5254,हे Pheebs,joy
4251,5255,ओह आपने बनाया,surprise
4252,5256,हाँ मैं बहुत लंबे समय तक उस पर पागल नहीं हो सकता।,neutral
4253,5257,हाँ वह चान लव के बिना नहीं रह सकती थी।,joy
4254,5258,ओह एक कमरा मिलता है।,disgust
4255,5259,हमारे पास एक है।,neutral
4256,5260,मुझे पता है। इसका प्रयोग करें।,disgust
4257,5261,Oh Mon मुझे सुनना है,surprise
4258,5262,ओके जॉय ट्रिबियन ने मुझे अपने अपार्टमेंट में वापस आमंत्रित किया अब वह बहुत सारी लड़कियों के साथ ऐसा करता है,neutral
4259,5263,हाँ बहुत कुछ। बहुत बहुत,neutral
4260,5265,लेकिन क्या आप शादी नहीं करते,neutral
4261,5268,यही कारण है कि वह यहाँ हो सकता है,neutral
4262,5269,यह क्या हो सकता है इस तथ्य के साथ कुछ भी नहीं है कि शायद मैं एक अच्छा श्रोता हूँ और मैं उह मैं एक पर डाल दिया,neutral
4263,5271,क्या,neutral
4264,5272,मुझे लगता है कि मैं खुद को ध्यान में रख सकता हूं मैं बाद में आपसे बात करूँगा।,neutral
4265,5273,गुड बाई,neutral
4266,5274,Whoa,surprise
4267,5275,वह वास्तव में आपकी बहन थी।,neutral
4268,5276,वह सोचती है कि आप,neutral
4269,5277,तो,neutral
4270,5278,मैं,sadness
4271,5279,आप यहाँ क्या कर रहे हैं,surprise
4272,5280,II अपने आइस क्यूब ट्रे को भरने के लिए आया था।,neutral
4273,5281,क्या,surprise
4274,5282,उम ठीक ठीक देखो।,neutral
4275,5286,अब मैं जानता हूँ कि मैं कहाँ से आया हूँ।,anger
4276,5288,यदि आप मेरी मदद कर सकते हैं पिता तो तुम्हें चाहिए,anger
4277,5289,अन्यथा आप,anger
4278,5290,इसलिए मुझे सच बताओ,anger
4279,5292,मेरे पिता Chuck Magioni है,surprise
4280,5293,नहीं कि सिर्फ चक Magioni मैं उसे पिछले साल एक घर बेच दिया,neutral
4281,5294,लेकिन मैं क्या जानता हूँ पिता है और यही सच है।,sadness
4282,5295,ओह,sadness
4283,5296,लेकिन क्या आप सही हैं,neutral
4284,5297,मुझे लगता है कि एक व्यक्ति को पता होना चाहिए कि वे कहाँ से आते हैं।,neutral
4285,5298,क्यों मैं ah ahh ठीक है।,neutral
4286,5299,मैं आपकी मां हूँ।,neutral
4287,5300,हे,surprise
4288,5301,मैं आज आपको बताना चाहता था लेकिन मैं सिर्फ़ मैं चाहता हूं कि मैं सभी फ्लॉपी महसूस कर रहा हूं और ,sadness
4289,5302,क्या,surprise
4290,5303,फिर आओ,surprise
4291,5305,सब ठीक है मैं हूँ मैं,sadness
4292,5306,मैं,neutral
4293,5308,मैं,sadness
4294,5310,Umm वहाँ किसी भी सवाल थे,neutral
4295,5311,पैलियोनेटोलॉजी के बारे में।,neutral
4296,5318,तुम कहाँ जा रहे हो,neutral
4297,5319,चलना,neutral
4298,5321,वास्तव में यह लंबे समय तक होगा। मुझे वास्तव में अपने विचारों को व्यवस्थित करने की आवश्यकता है।,neutral
4299,5322,आपका विचार Plural,surprise
4300,5323,ठीक है मैं सिर्फ एक सोचा था यह गर्म नानी के बारे में है मैंने उसे देखा,joy
4301,5324,मुझे डर है कि मैं आपको ऐसा नहीं कर सकता जो,neutral
4302,5329,क्या रॉस आपको बताता है कि मुझे वहां नहीं जाना चाहिए,neutral
4303,5330,हां वास्तव में उन्होंने किया इसलिए मैं आपको जाने नहीं दे सकता।,neutral
4304,5332,महान उपन्यास,surprise
4305,5333,ठीक  mediocre अश्लील,neutral
4306,5334,ठीक है मुझे लगता है कि हम इसे देखने से पहले मूल्यांकन वापस प्राप्त कर सकते हैं लेकिन हम श्री ज़ेलनर के कार्यालय में जाने वाले हैं।,neutral
4307,5335,अब वह नहीं करता है  तक नहीं मिलता इसलिए वह कोई समस्या नहीं है लेकिन उसके सहायक बेट्टी वह अपने डेस्क पर अपने नाश्ते के लिए जल्दी ही आती है।,neutral
4308,5337,येआ अच्छी तरह से बेट्टी दयालु है। यही कारण है कि मैं मानता हूँ कि मैं इन चॉकलेट के साथ उसे दूर कर सकता हूँ। अब जबकि मैं उसे विचलित करता हूँ,neutral
4309,5338,यह जाओ,joy
4310,5339,चलो,joy
4311,5340,हैलो राहेल आप उह एक मिनट मिला,neutral
4312,5341,Yeah सुनिश्चित करें कि श्री ज़ेलनर आपके लिए कुछ भी है ओके ठीक योजना शुरू करने के बाद योजना शुरू कर दी।,neutral
4313,5342,वास्तव में मैं तुम दोनों के साथ बात करना चाहता हूँ।,neutral
4314,5343,ओके क्या हम आपको कुछ भी प्राप्त कर सकते हैं शायद कुछ चॉकलेट,neutral
4315,5344,Cassie क्या आप वहाँ सब कुछ ठीक कर रहे हैं,neutral
4316,5345,हाँ मुझे यहाँ रहने के लिए धन्यवाद।,neutral
4317,5347,क्या,surprise
4318,5348,आप लोहे हैं।,neutral
4319,5349,आप स्टील हैं,joy
4320,5351,मैंने आपको बताया हम सभी समय नए ऑपरेटरों को जोड़ रहे हैं। क्या हम अपने प्रशिक्षण पर ध्यान केंद्रित कर सकते हैं,neutral
4321,5352,मेरा मतलब क्यों सभी लोगों में से आप चिप के साथ बाहर जाना चाहते हैं,surprise
4322,5353,देखो आप और मैं विभिन्न उच्च विद्यालयों के लिए चला गया ,neutral
4323,5354,ठीक है वह क्या करता है मेरी मदद नहीं करता क्योंकि हम उसी हाई स्कूल में गए थे।,neutral
4324,5355,आप जहां लोकप्रिय थे वहां गए और आपको चिप मोटरसाइकिल की सवारी करने और अपने लेटरमैन जैकेट पहनने के लिए मिला।,neutral
4325,5357,उन्हें विशेष रूप से बनाया गया था,surprise
4326,5358,यह होम ईसी कक्षाओं में से एक के लिए एक परियोजना थी।,neutral
4327,5359,हे मेरे परमेश्वर उन्होंने हमें बताया कि वह मर्दाना था,surprise
4328,5360,फिर मैंने सोचा कि मैं कभी नहीं कभी एक चिप मैथ्यू के साथ बाहर जाने का मौका मिलता है और अब वह वह मुझे बुलाया और मुझसे पूछा।,surprise
4329,5361,और मेरे अंदर वसा लड़की वास्तव में जाना चाहता है।,joy
4330,5362,मैं उसे यह पसंद करता हूँ।,neutral
4331,5363,मैं कभी उसे खाने नहीं देता।,neutral
4332,5364,ओह आप उसके साथ बाहर जाते हैं।,neutral
4333,5365,क्या वास्तव में,surprise
4334,5366,हाँ। बस अगर यह संभव है तो क्या आप उसे कहीं छोड़ सकते हैं और दूसरे लड़के के साथ यौन संबंध रख सकते हैं,neutral
4335,5367,मैं कोशिश करूँगा।,neutral
4336,5368,हे लंबा लड़का हे सुनो मैं आपसे उस लड़की के बारे में बात करना चाहता था जिसे आप किसके साथ नाच रहे हैं।,neutral
4337,5369,हाँ हाँ ठीक है।,neutral
4338,5371,ओह मनुष्य पर आते हैं आप मेरे साथी के साथ नृत्य कर सकते हैं वह असली उह mellow,anger
4339,5372,खैर मैं रात्रि के बाद उम्मीद कर रहा था कि शायद मैं तुम्हें जान सकता हूँ,neutral
4340,5373,रॉस इसे पाने के लिए ऐसा नहीं है कि वह आपसे नफरत करती है।,anger
4341,5374,हाँ लेकिन,sadness
4342,5375,रॉस वह अजीब नहीं है वह सिर्फ चाहती है कि वह एक तरह से एक हो।,neutral
4343,5380,Ooh Phoebe ठीक है चलो सभी रोशनी को बदल देते हैं और हम,joy
4344,5381,ओके हे,joy
4345,5382,क्या आप इसे पसंद करते हैं तुम कहाँ जानते हो,joy
4346,5383,ज़रूर,joy
4347,5385,आपने अपनी चादर को एक फ्लावर मार्केट में खरीदा है रॉस आने पर आपको मिलाता ने पर्स तार को थोड़ा ढीला कर दिया।,disgust
4348,5386,Joey,neutral
4349,5387,आप कैसे सोचते हैं कि वह क्या कर रही है,neutral
4350,5388,क्या मुझे लगता है कि वह गर्म है रॉस,surprise
4351,5389,Eh मेरा मतलब है मैं Mena वह unattractive लेकिन गर्म नहीं है ,surprise
4352,5390,धन्यवाद,joy
4353,5391,अब जब राहेल चले गए,neutral
4354,5394,क्या,surprise
4355,5395,बदसूरत नग्न आदमी की रसोई टाइल बिछाने। Eww,disgust
4356,5396,Eww मैं यहाँ एक पक्ष पूछ रहा हूँ। अगर मैं अपने भाई के लिए ऐसा करता हूँ तो शायद एंजेला मेरे पास वापस आ जाएगा।,disgust
4357,5398,मैं जानता हूँ लेकिन मैंने बहुत बड़ी गलती की। मुझे कभी उसके साथ नहीं टूटना चाहिए। क्या आप मेरी मदद करेंगे कृपया,sadness
4358,5399,तो शहद इस सुबह मज़ा था huh मुझे वहाँ बौछार में आप पर कूदना।,joy
4359,5400,हाँ शायद कुछ दिनों में हम दो बाथरूमों के साथ जगह ले सकते हैं।,joy
4360,5401,देखो कैरोल umm मैं था मैं शायद उह सोच रहा था शायद हम चीजों को थोड़ा मसाला दे सकते हैं।,neutral
4361,5402,आपका क्या मतलब है,surprise
4362,5403,क्या हमारा यौन जीवन है यह,sadness
4363,5404,वहाँ थोड़ा गिर गया,joy
4364,5405,हे उहhey क्यों नहीं,neutral
4365,5406,हे,joy
4366,5407,जय,joy
4367,5408,,surprise
4368,5409,जय,joy
4369,5410,जय,joy
4370,5412,क्या,neutral
4371,5413,क्या,neutral
4372,5414,क्या,surprise
4373,5416,Umm कुछ लोग एक दूसरे से सामान खाते हैं।,neutral
4374,5417,नहा,disgust
4375,5418,Umm y,neutral
4376,5419,Umm हम कर सकते हैं हम एक त्रिगुट हो सकता है।,neutral
4377,5420,मैं उस विचार से प्यार करता हूँ,joy
4378,5421,हे सोफी,joy
4379,5423,ओह कुछ प्रिय ग्राहक ने सुझाव बॉक्स में एक सुझाव दिया।,anger
4380,5424,हे मेरे परमेश्वर उन्होंने मेरा विचार लिया,surprise
4381,5425,क्या तुम,surprise
4382,5427,राहेल मैंने आपको कोको बनाया।,neutral
4383,5428,हे मेरे परमेश्वर क्या तुम लोग ठीक हो,surprise
4384,5429,क्या तुम सब ठीक हो,surprise
4385,5430,हे मेरे।,surprise
4386,5432,नमस्ते।,neutral
4387,5433,ओह मेरे गोश जोशुआ,surprise
4388,5434,उन सभी चीजों के बारे में मैंने कहा कि मैं तैयार नहीं हूं,neutral
4389,5436,नहीं वे,neutral
4390,5438,लेकिन,neutral
4391,5439,ओह ओह मैं उस पर प्यार करता हूँ।,surprise
4392,5440,क्या आप अंदर जाना चाहते हैं,neutral
4393,5441,हाँ।,neutral
4394,5442,ओके हर बार।,neutral
4395,5443,हे,joy
4396,5444,हे,joy
4397,5445,हे,joy
4398,5446,हे आप लोग विश्वास नहीं करेंगे कि मुझे आज काम के लिए क्या करना है।,neutral
4399,5447,हाँ लेकिन रॉस आप,neutral
4400,5449,ओह मुझे खेद है ओह मैं सिर्फ मैंने सोचा कि हम उन्हें मार दिया है और फिर कुछ मटर और प्याज जोड़ सकते हैं।,sadness
4401,5450,हम क्यों करेंगे,surprise
4402,5451,ठीक है क्योंकि तब वे मेरी माँ की तरह उन्हें बनाने के लिए इस्तेमाल किया गया था आपको पता था कि वह मर गया था।,sadness
4403,5452,ठीक है तीन प्रकार के आलू आते हैं।,neutral
4404,5454,सबसे अविश्वासशील बात हुई है। अंडरडॉग अभी ठीक हो गया है।,surprise
4405,5455,गुब्बारा,neutral
4406,5456,नहीं नहीं वास्तविक कार्टून चरित्र। बेशक गुब्बारा। यह खबर भर में है। इससे पहले कि वह पहुंच गया,neutral
4407,5457,मैं नहीं कर सकता मैं नहीं जा सकता।,neutral
4408,5458,आओ। एक  फुट इन्फैटेबल कुत्ते शहर को ढीला करते हैं। कितनी बार ऐसा होता है,surprise
4409,5460,क्या चाबियाँ हैं,neutral
4410,5461,ठीक,neutral
4411,5462,आप क्या सोचते हैं,neutral
4412,5463,लोटसा बातें।,neutral
4413,5464,क्या आप सोचते हैं कि वह क्या है,neutral
4414,5465,क्या मैं आपकी मदद कर सकता हूँ,neutral
4415,5466,ओह धन्यवाद हम सिर्फ देखने के लिए यहाँ हैं।,neutral
4416,5467,आप एक नृत्य कक्षा का निरीक्षण नहीं करते हैं। आप,neutral
4417,5468,उनका क्या मतलब है,neutral
4418,5469,मुझे लगता है कि उसका मतलब है आप,neutral
4419,5472,वह आपको हो सकता है।,neutral
4420,5473,चलो शुरू हो जाओ। पांच छः छः सात आठ आठ,neutral
4421,5474,ठीक है मुझे यह नहीं मिल रहा है,anger
4422,5475,मैं पूरी तरह से इसे प्राप्त कर रहा हूँ,joy
4423,5477,क्या जब वे क्लिक करते हैं तो बस क्लिक करें।,surprise
4424,5478,अब हर कोई एक साथी को पकड़ लेता है।,neutral
4425,5479,ओके और मेरी मृत मां कहती है आप हैं यह। मैं राहेल के साथ हूँ।,neutral
4426,5480,महान। यह फिर से जिम क्लास है।,disgust
4427,5481,मैं पागल नहीं हूँ इसका मतलब यह नहीं था।,surprise
4428,5482,Nooo यह नहीं था।,neutral
4429,5483,ओह और यह इतना अच्छा है कि इस छोटे से सिंक यहाँ है।,joy
4430,5484,क्या यह अच्छा नहीं है यह इतना शांत है मैं आज भी यहां रह सकता हूँ।,joy
4431,5485,मैं जानता हूँ,neutral
4432,5486,अपना ड्रैप खोलें अपना ड्रैप खोलें,joy
4433,5487,मुझे बहुत खुशी है कि हम कमरे में रहने वाले हैं,joy
4434,5488,सूर्य बाहर है,joy
4435,5490,ठीक है आप पूल में जाते हैं और कुर्सियों को आरक्षित करते हैं और मुझे पत्रिकाओं और लोशन मिलेगा।,neutral
4436,5491,देवियों रॉस का भाषण  मिनट में है।,neutral
4437,5492,Nooo,sadness
4438,5493,इसे डुबोना,anger
4439,5496,हम वास्तव में हमारे शोध चक्रों में से एक के अंत में हैं इसलिए हम अभी आवेदकों की तलाश नहीं कर रहे हैं।,neutral
4440,5497,क्या है मैं क्या आप जानते हैं,sadness
4441,5498,ठीक है यहाँ क्या,neutral
