,Unnamed: 0,Translated_Utterance,Emotion
1964,2417,मैं कैसे जवाब दे सकता हूँ कि मैं,neutral
1965,2419,वास्तव में फिर यहां कोई भी उन्हें कैसे पहने,neutral
1966,2420,वे सभी पर्यटक हैं।,neutral
1967,2421,सब ठीक है अगर आप उसको पहनने पर जोर देते हैं तो सार्वजनिक रूप से y जानते हैं आप,disgust
1968,2425,ठीक है प्रतीक्षा करें। सब ठीक है कि यह ठीक है मैं यहाँ से बाहर हूँ। अब मैं शर्मिंदा नहीं हूँ,anger
1969,2426,तो मैं सिर्फ एक खाली फूलदान हूँ,surprise
1970,2427,क्या,surprise
1971,2428,हां इसलिए मैंने उतनी महत्वपूर्ण पुस्तकों को नहीं पढ़ा है जितना आप करते हैं और मैं चाल कविताओं को नहीं लिखते हैं जो लगभग एक चीज लगते हैं लेकिन वास्तव में कुछ और के बारे में हैं।,anger
1972,2429,और मैं क्या जानता हूँ मैं स्टुपिड सामान के बारे में उत्साहित हूं जैसे मैं मेरा हूं,neutral
1973,2430,Whoa whoa whoa,surprise
1974,2431,आप मुझे नहीं जानते ,anger
1975,2432,Whoa whoa whoa कविता आपके बारे में नहीं है।,surprise
1976,2433,क्या,surprise
1977,2434,खाली फूलदान आपके बारे में नहीं है। मेरे बच्चे तुम मुझे इतना दुखी है कि तुम यह सोचना होगा।,sadness
1978,2435,मुझे माफ़ी है मेरा दोस्त Phoebe ,sadness
1979,2436,नहीं यह सभी महिलाओं के बारे में है। खैर सभी अमेरिकी महिलाओं। अब आप बेहतर महसूस करते हैं,neutral
1980,2437,ओह,neutral
1981,2438,ओके आगे। Forward ठीक है वापस ठीक है आगे बंद करो,neutral
1982,2439,रॉस इसके बारे में बस भूल जाते हैं। इस आदमी को तुम पूरी तरह से wedged में मिल गया।,neutral
1983,2440,क्या यह तुम्हारा है,neutral
1984,2441,वास्तव में,neutral
1985,2443,आप इस कार की जरूरत है।,neutral
1986,2444,ओके,neutral
1987,2445,क्या हम,neutral
1988,2447,आप लोग इसे आगे बढ़ाते हैं इसलिए रॉस अपने स्थान से बाहर निकल सकते हैं।,neutral
1989,2448,ओके,neutral
1990,2449,यहाँ हम जाते हैं।,neutral
1991,2451,,neutral
1992,2452,इसलिए यह कहा जाता है कि वर्ष  तक ऐसे कंप्यूटर होंगे जो वास्तविक मानव मस्तिष्क के रूप में समान कार्यों को पूरा कर सकते हैं।,neutral
1993,2453,इसलिए सैद्धांतिक रूप से हम इस कंप्यूटर में हमारे विचारों और हमारी यादों को डाउनलोड कर सकते हैं।,neutral
1994,2454,और हमेशा के लिए एक मशीन के रूप में रहते हैं,joy
1995,2455,क्या आप जानते हैं कि हम अभी क्या कर रहे हैं,joy
1996,2456,आप और मैं हम हस्तक्षेप कर रहे हैं।,neutral
1997,2458,Ba dum bumb cheshh,joy
1998,2459,डेविड क्या आप मेरी मदद कर सकते हैं मैं चांदलर को समझाने की कोशिश कर रहा हूं कि कैसे विमान हवा में रहता है।,neutral
1999,2460,ओह निश्चित रूप से। यह बर्नौली के सिद्धांत और न्यूटन के तीसरे कानून का संयोजन है।,neutral
2000,2461,देखें,neutral
2001,2463,ठीक है मैं यात्रा के लिए कुछ चीजें लेने जा रहा हूँ।,neutral
2002,2464,ओह मुझे भी जाना चाहिए।,neutral
2003,2465,ओह अब  कल क्या आप लोग हवाई अड्डे के लिए एक टैक्सी साझा करना चाहते हैं या माइक होना चाहिए और मैं सिर्फ वहाँ से मिलते हैं।,neutral
2004,2468,मैंने उनसे पूछा।,neutral
2005,2470,इसलिए अब मुझे ऐसा करना होगा कि मैं उसे देखकर पूरी तरह ठीक हूँ,joy
2006,2473,और आप चाहते हैं कि वह अपने दिल को बाहर खाएं ताकि आप शानदार दिख सकें,neutral
2007,2475,हे Pheebs मैं चार्ली खरीदारी कर रहा हूँ क्यों आप नहीं आते और मैं आपको कुछ खोजने में मदद करूँगा।,neutral
2008,2476,ठीक है,joy
2009,2477,क्या यह अच्छा नहीं है आप में से तीन एक साथ slutty नीचे पहनने के कपड़ा पर कोशिश कर रहे हैं।,disgust
2010,2478,क्या हम क्या कर रहे हैं,disgust
2011,2479,आप इसे क्यों बर्बाद कर सकते हैं,disgust
2012,2480,Julie hi चांदलर बिंग मुझे लगता है कि मुझे याद है।,joy
2013,2481,हैलो स्किडमार्क।,neutral
2014,2482,यह,neutral
2015,2483,यह बहुत स्पष्ट है।,neutral
2016,2484,आह उह मैं तुम्हें एक लंबे समय से अतिदेय अपोलोजी की तलाश में हूँ। मुझे कभी भी आपके साथ नहीं टूटना चाहिए क्योंकि आप अधिक वजन वाले थे।,neutral
2017,2485,क्यों तुम मेरे साथ टूट,surprise
2018,2487,Nichou chima,joy
2019,2489,सभी को नमस्कार।,neutral
2020,2490,मैं चाहता हूँ कि मैं आपको हमारी उह के लिए धन्यवाद देना चाहता हूं इससे पहले हमारी छोटी बात।,neutral
2021,2492,ठीक है मैं जा रहा था लेकिन उसके बाद मैंने आपसे बात की मैंने जॉय से बात की।,neutral
2022,2493,उसने क्या कहा,fear
2023,2494,मूल रूप से उन्होंने मुझे अपने ऊपर जाने और बस इसे करने के लिए कहा ya जानते हैं।,neutral
2024,2495,इसलिए मैं हालांकि आपके बारे में क्या कहता हूं और मैं हालांकि उस बारे में जो उसने कहा और अच्छी तरह से उसका तरीका मुझे रात्रिभोज होना चाहिए।,neutral
2025,2496,।,neutral
2026,2497,।,neutral
2027,2498,ओह महान,joy
2028,2499,हम क्या कर सकते हैं हमारी आँखों को हर रात एक दूसरे से दूर नहीं रख सकते और फिर हर बार और कुछ देर में y,joy
2029,2501,मैं सोच सकता हूँ कि क्या मैं सोच रहा हूँ क्या वह मुझे चुम्बन करता है,joy
2030,2502,उन्होंने क्या किया,neutral
2031,2503,मैं मैं एक महिला मोनिका हूँ मैं नहीं जानता लेकिन यह hickey खुद के लिए बोलती है।,joy
2032,2504,ठीकठीक मुझे मिला। मुझे मिला।,neutral
2033,2505,मुझे बहुत पसंद है कि मैं सिर्फ़ इस तरह महसूस करता हूं कि मेरे पास आज  पेय हैं और मैंने केवल छह ही थे।,joy
2034,2507,क्यों मैं,sadness
2035,2508,आप एक आदमी की तरह ध्वनि करते हैं।,disgust
2036,2509,नहीं एक आदमी कह सकता है मैं मैं कभी किसी और के साथ नींद नहीं जा सकता।,disgust
2037,2510,हे मेरे परमेश्वर,surprise
2038,2512,मैं इतनी व्यस्त थी कि मैं शादी की योजना बना रहा हूं कि मैं उन सभी चीजों के बारे में भूल गया हूं जिन्हें मैं दे रहा हूँ,surprise
2039,2513,मेरा मतलब है मैं हूँ मैं कभी नहीं करने के लिए एक बार फिर से चुंबन है।,sadness
2040,2514,आपके पास आखिरी चुंबन होगा।,neutral
2041,2515,वापस आने के लिए धन्यवाद।,joy
2042,2517,मैं मोना जानता हूँ बस मुझे सुनो।,neutral
2043,2518,सबसे पहले मैं आपके पिता के बारे में इतनी चिंता करता हूँ लेकिन मैंने आपको पूरी तरह से खुद ही सुना।,neutral
2044,2519,क्या आप जानते हैं,neutral
2045,2520,फोकस,neutral
2046,2521,Okay Umbout और हाँ हम एक बच्चे हैं। लेकिन हम हैं,neutral
2047,2522,सब ठीक है कि,neutral
2048,2523,Joey वे मेरे मातृत्व पैंट हैं,surprise
2049,2524,अभी नहीं ये मेरी धन्यवाद पैंट हैं,joy
2050,2525,नहीं,neutral
2051,2526,नहीं,anger
2052,2528,अहम,neutral
2053,2529,ओह क्या आप उस मोनिका को देख सकते हैं,joy
2054,2530,मैं सिर्फ अपने सभी शीर्ष स्कोर कैसे उदास दूर दस्तक दिया।,joy
2055,2531,ठीक है मैं क्या क्या आप एक दूसरे से खेल सकते हैं मैंने कहा Phoebe,anger
2056,2532,ओह मैं मैंने क्या किया,joy
2057,2533,चांदलर Phoebe खेल hogging,anger
2058,2534,याद रखें कि जब आप चाहते थे तो मुझे दूसरे दिन कमरे को छोड़ना पड़ा,neutral
2059,2535,हाँ। लेकिन मैंने सोचा कि क्योंकि मैं अपने हाथ में पूरी चीज़ डालता हूं और इसे मेज पर चला जाता है।,neutral
2060,2536,वैसे भी यह सिर्फ़ करता है सिर्फ तीन लोगों के लिए पूरी टर्की बनाने के लिए इसके लायक नहीं लगता है। ओके यह बहुत काम करता है।,neutral
2061,2541,नहीं मैं वादा करता हूं कि मैं उस टर्की को खत्म कर दूँगा,joy
2062,2543,यह सही है,joy
2063,2544,क्या मैं,joy
2064,2545,क्या हम करते हैं,neutral
2065,2547,हम खा सकते हैं,joy
2066,2548,खैर,neutral
2067,2549,वाह यह बहुत बड़ा है यह क्यूबिकल से बहुत बड़ा है। ओह यह एक घन है।,surprise
2068,2550,इसे देखो,joy
2069,2551,ओह आपके पास एक विंडो है,surprise
2070,2552,वास्तव में एक सुंदर दृश्य के साथ ,joy
2071,2553,ओह लुक वह पुरुष peeing,surprise
2072,2554,नमस्ते।,neutral
2073,2555,नमस्ते।,neutral
2074,2557,ओह,neutral
2075,2558,ओके चलो इस ब्रश का उपयोग करें।,neutral
2076,2559,ओके यह सामान,neutral
2077,2560,हाँ।,neutral
2078,2561,ठीक है।,neutral
2079,2562,सावधानीपूर्वक। प्रकाश। ठीक है क्या आपको पता है कि कैसे बस इसे lid पर फेंक दें। ओके बस इसे स्वीप करें।,neutral
2080,2563,Okedokey,neutral
2081,2564,वास्तव में आपका चिड़ियाघर कहाँ है,neutral
2082,2565,ठीक है यह तकनीकी रूप से एक चिड़ियाघर नहीं है यह एक इंटरैक्टिव वन्यजीव अनुभव का अधिक है।,neutral
2083,2566,क्या मुझे कुछ सवाल पूछते हैं,neutral
2084,2567,हाँ।,neutral
2085,2568,क्या वह उह अन्य जानवरों के साथ लड़ता है,neutral
2086,2570,यहां तक कि अगर वह था,neutral
2087,2571,मैं नहीं जानता हूँ। क्यों,neutral
2088,2572,उह वह छोटी वस्तुओं को कैसे संभाल सकता है,neutral
2089,2574,कैसे एक हथौड़ा या एक छोटे ब्लेड के बारे में,neutral
2090,2577,अन्यथा यह सिर्फ क्रूर है।,neutral
2091,2578,वह उसे मिला वह सैन डिएगो में मिला।,joy
2092,2579,हम वापस हमारे चलने से आते हैं और फोन रिंगिंग था।,neutral
2093,2580, वह अंदर है।,neutral
2094,2581,वह है ओह क्या आपने सुना है कि मार्सेल सैन डिएगो। सैन डिएगो,joy
2095,2582,आप यहाँ एक बड़ी गलती कर रहे हैं।,disgust
2096,2583,मेरा मतलब है सैन डिएगो के सभी अच्छे और अच्छे हैं लेकिन अगर आप उसे मुझे देते हैं तो मैं उसे एक अंधे खरगोश के खिलाफ शुरू करूँगा और आपको बीस प्रतिशत लाभ देगा।,neutral
2097,2585,वास्तव में इस प्रक्रिया को गति देने में मदद की,joy
2098,2586,Janice,surprise
2099,2587,तुम नहीं हो,surprise
2100,2588,ओह,surprise
2101,2589,Sid अभी भी अपने कमरे में है।,neutral
2102,2591,तो क्या आपने ऐसा किया,surprise
2103,2592,क्या आप अपनी जमा राशि बना सकते हैं,neutral
2104,2593,हाँ हाँ कठिन हिस्सा खत्म हो गया है,joy
2105,2594,यह कठिन हिस्सा शहद नहीं है मैं नहीं जानता कि मैं क्या करता हूँ,fear
2106,2596,ओह क्या आप जानते हैं यह शायद है।,neutral
2107,2599,आप नहीं कर सकते।,anger
2108,2600,मुझे देना,anger
2109,2601,नहीं,anger
2110,2602,मैं वहाँ जाना चाहता हूँ।,anger
2111,2604,Phoebe यहाँ आना,neutral
2112,2605,हाहा,joy
2113,2606,आप Monica Geller hyphen Bing,anger
2114,2607,हम क्या गलत था ओह देवता मैं सिर्फ उन लोगों के साथ यौन संबंध रखता हूं जो द्विशताब्दी के दौरान जीवित नहीं थे।,disgust
2115,2608,मेरे पास सिर्फ यौन संबंध था।,neutral
2116,2609,एथेन फोकस। आप मुझे कैसे नहीं बता सकते,surprise
2117,2610,ठीक है आपने मुझे कभी नहीं बताया कि आप कितने पुराने थे।,neutral
2118,2611,ठीक है यह अलग है। मेरे झूठ ने  राज्यों में से एक को एक felon नहीं बनाया था। क्या आप सोच रहे थे,disgust
2119,2612,मैं सोच नहीं रहा था। मैं बहुत व्यस्त हूँ,joy
2120,2613,यह मत कहो।,fear
2121,2614,आपके साथ प्यार करो।,joy
2122,2615,वास्तव में,surprise
2123,2616,Sorry,sadness
2124,2617,खैर इससे बाहर निकलें।,anger
2125,2618,आपको पता है कि आपको यहां भी नहीं होना चाहिए यह एक स्कूल की रात है।,anger
2126,2620,मैं उन महिलाओं की तरह हूं जिन्हें आप चाड नाम के चमकदार लोगों के साथ देखते हैं।,disgust
2127,2621,मैं जोआन कॉलिन हूँ।,disgust
2128,2622,कौन,neutral
2129,2624,क्या आप जानते हैं,neutral
2130,2625,आप जैसा आपने किया है,anger
2131,2626,मैं जानता हूँ कि आप कितने गलत हैं मैं चाहता हूँ कि मैं क्या कर सकता हूँ।,neutral
2132,2627,मेरा मतलब है मैं चाहता हूँ कि मैं एक समुद्रवासी हूँ।,neutral
2133,2628,क्योंकि समुद्र के साथ यह पुरुष वे बच्चों को ले जाते हैं।,neutral
2134,2631,मैं जानता हूँ मैं मैं अंत की ओर याद रखता हूँ,neutral
2135,2632,Oh Phoebe that,neutral
2136,2634,हे भगवान,anger
2137,2635,बाहर निकलना,anger
2138,2636,बाहर निकलना,anger
2139,2637,बाहर जाओ,anger
2140,2638,,anger
2141,2639,चलो,neutral
2142,2640,सब ठीक है मैं जानता हूँ मुझे पता है। हाँ यह ठीक हो जाएगा।,joy
2143,2641,Oh my God क्या,fear
2144,2642,मैं क्या देख सकता हूँ,fear
2145,2643,ओह,neutral
2146,2646,Terrified,fear
2147,2647,Ohheyheyhey आप क्या हैं,joy
2148,2648,Umm सुनो वहाँ कुछ है मुझे लगता है कि आपको पता होना चाहिए।,neutral
2149,2649,ओह क्या यह आपके बारे में है,surprise
2150,2650,Yeah Joey ने पहले से ही मुझे बताया और मैं तो ठीक हूँ।,neutral
2151,2651,मेरा मतलब है आप और मैं सिर्फ हूँ yknow हम कुछ नहीं कर रहे हैं हम चारों ओर गूफिन हैं।,neutral
2152,2652,Umm वास्तव में मैं आपको बताता हूं कि मैं था मैं उससे बाहर निकलने जा रहा था लेकिन हे अगर हम अभी तो उह के आसपास घूम रहे हैं शायद मैं,neutral
2153,2653,ठीक शायद मैं भी हूँ,joy
2154,2657,MY SANDWICH ,anger
2155,2658,क्या,neutral
2156,2660,क्या,surprise
2157,2661,हाँ उसने उसे अचानक शहर से बाहर जाना पड़ा।,sadness
2158,2662,वह मुझे बचाती है वह क्या करती है मुझे नहीं बताना चाहता कि मेरा पिता कहां है।,sadness
2159,2663,वह जानता है और उसने मुझे नहीं बताया।,sadness
2160,2664,Aww Pheebs that sucks,sadness
2161,2665,हाँ अच्छी तरह से क्या,sadness
2162,2666,कहाँ जा रहा है,neutral
2163,2667,ठीक है वह शहर से बाहर निकलती है तो उसके घर में कुछ ऐसा होता है जो मुझे बताता है कि मेरा पिता कहां है।,neutral
2164,2668,उह फ़िब्स कुछ लोग कहते हैं कि ब्रेकिंग और प्रवेश।,fear
2165,2669,खैर यहाँ उन लोगों में से कोई हैं,anger
2166,2670,हे मेरे परमेश्वर,surprise
2167,2671,मुझे पता था wow,surprise
2168,2672,प्रतीक्षा करें पिल्ले प्यारा या बदसूरत,neutral
2169,2673,ओह इतना प्यारा।,joy
2170,2674,अच्छा लेकिन अगर मैं हूँ,anger
2171,2676,क्या आप खाना चाहते हैं मैं,neutral
2172,2677,हे मुझे भी,surprise
2173,2679,ठीक है आप ऐसा कर सकते हैं।,neutral
2174,2680,यह सिर्फ एक बैंडसहायता को खींचने की तरह है।,neutral
2175,2681,यह वास्तव में तेजी से करता है और फिर घाव उजागर होता है।,neutral
2176,2682,जनवरी। हाय जेनिस। ठीक है यहाँ हम जाते हैं। मुझे नहीं लगता कि हम अब बाहर जाना चाहिए। जनवरी।,sadness
2177,2683,ठीक है। ठीक है वहाँ तुम जाओ। इसे बंद करो इसे बंद करो।,anger
2178,2684,हे मेरे परमेश्वर उस आदमी को काउंटर पर पूरी तरह से आप की जाँच कर रहा है,surprise
2179,2685,वास्तव में मेरा परमेश्वर वह वास्तव में प्यारा है।,surprise
2180,2686,इसके लिए जाओ।,neutral
2181,2687,Phoebe मैं,surprise
2182,2688,मैं,neutral
2183,2689,लेकिन नहीं चांदलर एक दुर्घटना में है और क्या आप यौन रूप से नहीं कर सकते हैं और वह चाहते हैं कि आप अपनी आवश्यकताओं को पूरा करने के लिए एक प्रेमी लें।,neutral
2184,2691,वैसे आपको शर्मिंदा होना चाहिए।,disgust
2185,2692,मैंने किया लेकिन यह वास्तव में मजेदार था।,joy
2186,2693,हे,neutral
2187,2694,चांदलर मैंने सोचा कि यह आप था।,neutral
2188,2695,क्या,surprise
2189,2696,Unagi मैं हमेशा जागरूक हूँ।,neutral
2190,2698,क्या,neutral
