,Unnamed: 0,Translated_Utterance,Emotion
6453,7937,मुझे पता है कि यह धन्यवाद की तरह नहीं है कि आप सभी की योजना बनाई गई है लेकिन मेरे लिए यह वास्तव में बहुत अच्छा रहा है आपको पता है कि मुझे लगता है क्योंकि इसमें तलाक या प्रोजेक्टाइल उल्टी शामिल नहीं थी।,joy
6454,7939,इसलिए मुझे लगता है कि मैं क्या कहने की कोशिश कर रहा हूं कि मैं बहुत आभारी हूं कि आपके सभी धन्यवाद चूसा।,joy
6455,7940,यह इतना मीठा है।,joy
6456,7941,और हे यहाँ एक क्रिसमस के लिए है।,joy
6457,7942,और एक नया साल मुबारक।,joy
6458,7943,यहाँ,joy
6459,7944,अब पकड़ो,anger
6460,7945,पकड़ो,anger
6461,7946,देखो देखो आपकी बेटी और मुझे अपने हनीमून के लिए आज रात को छोड़ने की आवश्यकता है अब आप जानते हैं कि मैं उस हवाई अड्डे पर जाना चाहता हूँ और मुझे उम्मीद है कि वह क्या होगा,anger
6462,7951,कृपया मुझे वादा करें कि आप उसे बता देंगे।,sadness
6463,7953,मुझे बुलाओ।,neutral
6464,7954,आप बाथरूम में आधा अपना जीवन बिताते हैं क्यों नहीं आप कभी भी खूनी खिड़की से बाहर नहीं जा सकते,anger
6465,7955,क्या हुआ,surprise
6466,7956,खैर मैं क्या जानता हूँ,surprise
6467,7957,हम सो गए यह सब है।,neutral
6468,7958,हाँ। Yep हाँ। ठीक है अच्छी तरह से उह मैं बेहतर हूँ।,neutral
6469,7959,मुझे लगता है कि यह सबसे अच्छा होगा।,neutral
6470,7960,हाँ। सब ठीक है मैं बाद में आपसे बात करूँगा।,neutral
6471,7964,क्या आपके पास एक मिनट है मैं कुछ बुरा खबर है। मुझे नहीं लगता कि मैं तुल्सा में जा सकता हूं।,sadness
6472,7965,क्या,surprise
6473,7966,यह वास्तव में एक मजेदार कहानी है।,neutral
6474,7967,मैं इस सुबह बैठक में सो गया तो मैंने कहा कि मैं तुल्सा में चल रहा हूँ मैं वास्तव में नहीं जानता कि मैं क्या कह रहा था।,neutral
6475,7968,आप सो गए,surprise
6476,7969,लेकिन सिर्फ इसलिए क्योंकि मैं इस बैठक के बारे में चिंतित था क्या वह मजाकिया नहीं था,fear
6477,7970,आयरनी,surprise
6478,7971,एक प्रशंसक नहीं ठीक है।,neutral
6479,7972,देखें यहाँ बात है।,neutral
6480,7973,मैं घर गया और मेरी पत्नी को तुल्सा के बारे में बताया और वह नहीं जाना चाहता।,neutral
6481,7974,मैं तुल्सा से प्यार करता हूँ,joy
6482,7975,तुल्सा स्वर्ग है,joy
6483,7976,तुल्सा इटली है कृपया मुझे वहाँ नहीं जाना चाहिए,fear
6484,7978,नहीं,fear
6485,7979,देखो कैरोल मैं तुम्हें कैरोल कह सकता हूँ,neutral
6486,7984,मैं आपको तुल्सा से बुलाऊंगा।,neutral
6487,7985,नमस्ते।,neutral
6488,7986,हे,neutral
6489,7987,आप कैसे हैं,neutral
6490,7988,मैं बहुत बुरा नहीं हूँ। वास्तव में नीले रंग का मेरा रंग। आप कैसे जानते थे कि मैं यहाँ था,neutral
6491,7989,क्योंकि मैं मोनिका गेलर हूँ। यह मेरा क्रेडिट कार्ड था जिसका आप उपयोग कर रहे थे।,neutral
6492,7990,मुझे उम्मीद नहीं थी।,surprise
6493,7991,मैं चाहता हूँ कि आप जानना चाहते हैं यह मैं नहीं था जो आपको बताता था।,neutral
6494,7992,ओह धन्यवाद।,neutral
6495,7993,नहीं धन्यवाद आपने मुझे बहुत कुछ दिया है मेरा मतलब है अगर यह तुम्हारे लिए नहीं था तो मैं कभी नहीं गाना चाहता,joy
6496,7994,वास्तव में आपको केवल मेमो गाने के लिए मिला।,neutral
6497,7995,मैं सिर्फ इतना विश्वास नहीं कर सकता कि आप यहाँ हैं।,surprise
6498,7996,मैं क्या हूँ,sadness
6499,7999,उह  ओह Mindy आप इतने स्टुपिड हैं। ओह हम दोनों तो stupid हैं।,disgust
6500,8000,आपका क्या मतलब है,neutral
6501,8001,Smell परिचित,neutral
6502,8002,ओह,fear
6503,8003,ओह मैं बहुत दुखी हूँ।,sadness
6504,8004,मुझे नहीं मैं बहुत दुखी हूँ,sadness
6505,8005,हे मेरे।,surprise
6506,8006,ठीक है वहाँ कोई रास्ता नहीं है मैं एक शॉट प्राप्त कर रहा हूँ।,fear
6507,8007,शायद वे सुई ले सकते हैं और इसे मेरे मुंह में थक्का कर सकते हैं आप जानते हैं एक थक्का बंदूक की तरह।,fear
6508,8008,क्या मैं आपको सिर्फ एक मिनट के लिए देख सकता हूँ मेरे भाई के पास सुइयों के बारे में मामूली भय है।,neutral
6509,8009,क्या आपने उसे अपने थक्के के बारे में बताया,neutral
6510,8010,मेरे भाई पीएचडी जानना चाहते हैं कि क्या इस मौखिक रूप से इलाज करने का कोई तरीका है।,neutral
6511,8011,नहीं इन परिस्थितियों में यह एक इंजेक्शन होना चाहिए और अब होना चाहिए।,neutral
6512,8012,क्या,neutral
6513,8014,यह अच्छा है एक सीट है।,neutral
6514,8015,उम डॉक्टर कहते हैं कि यह एक सुई है।,neutral
6515,8016,क्या आपको सिर्फ़ ब्रेक होना चाहिए,neutral
6516,8017,क्या आप मुझे ऐसा कर सकते हैं,neutral
6517,8018,ठीक,neutral
6518,8019,ठीक Oh boy आप बहुत अच्छे हैं। क्या आप अपना हाथ तोड़ना चाहते हैं,neutral
6519,8020,हाँ,fear
6520,8021,ओके,neutral
6521,8022,ठीक है रॉस इसे इतना मुश्किल नहीं निचोड़ते।,neutral
6522,8023,हनी वास्तव में यह इतना कठिन नहीं निचोड़,anger
6523,8024,ओह रॉस,anger
6524,8025,चलो मेरे हाथ,anger
6525,8026,क्या तुम मुझे बहुत प्यार करते हो मुझे टिकट मिला ,joy
6526,8027,हे मेरे परमेश्वर मैं तुम्हें प्यार करता हूँ आप कैसे करते हैं,joy
6527,8028,Fortune,neutral
6528,8029,Oo जहां सीटें हैं,joy
6529,8030,उह मध्यम बालकनी।,neutral
6530,8031,तुम,anger
6531,8034,यह आपके अंदर की ताकत है जिसका अर्थ मेरे लिए सबसे ज्यादा है।,joy
6532,8035,तुम,joy
6533,8036,यही कारण है कि मैं चाहता हूँ कि मैं प्यार करता हूँ,joy
6534,8037,इसका मतलब मुझे कुछ नहीं है। आओ,anger
6535,8039, हे,neutral
6536,8040, आप क्या कर रहे हैं,neutral
6537,8042,नहीं आप,anger
6538,8043,मैं मैंने क्या किया मैं नहीं हूँ,sadness
6539,8044, ओह हाँ निश्चित रूप से आप क्या करते हैं,anger
6540,8045,नहीं,neutral
6541,8046,क्या आप एक छोटी राजकुमारी हैं डैडी मुझे एक पिज्जा खरीदते हैं। डैडी मुझे एक कैंडी कारखाना खरीदते हैं। डैडी,disgust
6542,8048, आपको लगता है कि आप एक गड़बड़ बना सकते हैं और कवरॉल में बड़ा आदमी यहां आ जाएगा और इसे साफ कर सकता है।,anger
6543,8049,क्यों,anger
6544,8050,ठीक है मैं,sadness
6545,8052,यह क्या है,neutral
6546,8053,ओह सही है कि लड़की का फोन नंबर।,neutral
6547,8055,यह कोई बड़ा सौदा नहीं है मेरा मतलब है कि यह उसका घर फोन नंबर है लेकिन Whoa,surprise
6548,8056,Whoawhoop मैं लगभग इस बच्चे को खो दिया,joy
6549,8058,धन्यवाद।,neutral
6550,8059,मैं क्या नहीं जानता,surprise
6551,8060,आपने उन्हें सब खोला,surprise
6552,8062,ओह हे आप मेरे मातापिता उपहार मिला,joy
6553,8063,हाँ। क्या है,neutral
6554,8066,हाँ। क्या टैग कहते हैं,neutral
6555,8068,मैं रच करता हूँ। मैं तुम्हारे लिए बहुत खुश हूँ।,joy
6556,8069,ओह वाह तुमने क्या किया,surprise
6557,8070,तो क्या आप कभी कभी कह सकते हैं कि यह कौन है,neutral
6558,8073,मैं नहीं हूँ,surprise
6559,8074,मैं उह यह वहाँ विशेष रूप से अगर आप एक माँ हैं बाहर एक डरावना दुनिया,fear
6560,8076,क्या,neutral
6561,8077,तो राहेल ग्रीन क्या आप मुझसे शादी करेंगे,joy
6562,8078,धन्यवाद।,neutral
6563,8079,अगर मैं क्या कर सकता हूँ,anger
6564,8080,क्या मैं उसे विश्वास नहीं कर सकता,disgust
6565,8081,अब मोनिका मैं तुम्हें पता है upset लेकिन क्या भूल जाओ,neutral
6566,8082,वहाँ एक शादी होने जा रहा है आप गुलदस्ता फेंकने के लिए जा रहे हैं और,neutral
6567,8083,पेरिस,neutral
6568,8084,हम Rue de la पर एक moonlit चलना होगा।,neutral
6569,8085,बात करते रहो।,neutral
6570,8086,फिर हम बिस्तर पर गुलाब पैडल छिड़केंगे और प्यार करेंगे। सिर्फ इसलिए नहीं क्योंकि यह रोमांटिक है लेकिन क्योंकि मैं कर सकता हूँ,joy
6571,8087,मैं तुम्हें प्यार करता हूँ,joy
6572,8088,हाँ,joy
6573,8089,मैं फिर से जीतता हूँ,joy
6574,8090,हे,joy
6575,8091,यही कारण है कि  रुपये की तरह आप मुझे owe,joy
6576,8092,Whoohoo,joy
6577,8093, जो बिजली की लूट है,joy
6578,8094,कौन हो,joy
6579,8095,मैं कुछ भोजन खरीदता हूँ।,neutral
6580,8097,आप गंभीर,surprise
6581,8099,नमस्ते,joy
6582,8100,ओके,neutral
6583,8101,यहाँ हम जाते हैं। Ready,neutral
6584,8104,कौन है,surprise
6585,8106,मैं बहादुर हूँ,fear
6586,8107,I am brave,fear
6587,8108,कोई नहीं,fear
6588,8109,क्या आप मुझे बता सकते हैं कि कौन क्या है,neutral
6589,8110,हाय,joy
6590,8111,नमस्ते। क्या आपको पता है कि क्या समय है,neutral
6591,8112,यह कैंडी समय मेरे रूममेट कहते हैं कि वे स्वर्ग की छोटी बूंदों की तरह स्वाद लेते हैं।,joy
6592,8113,ओह कृपया क्या आप जानते हैं स्वर्ग की छोटी बूंदें।,joy
6593,8114, बजे,neutral
6594,8115,तो मैं कुछ कैंडी प्राप्त कर सकता हूँ,neutral
6595,8116,हममें से कुछ को क्षमा करना चाहिए लेकिन हममें से कुछ को क्षमा करना चाहिए।,neutral
6596,8117,Umm सुनो मैं खेद है लेकिन मैं सुबह में कुछ पहली चीज़ डालूँगा।,sadness
6597,8118,ठीक है मैं बाद में स्विंग करूँगा। क्या आप इस इमारत में रहते हैं,neutral
6598,8119,उमhmm।,neutral
6599,8120,एमएम मैं तुम्हें याद करता हूँ,surprise
6600,8121,To make a night,neutral
6601,8123,जब तक वह यहां पढ़ता है और वह,neutral
6602,8124,क्या आप चाहते हैं,neutral
6603,8125,तो मैं उह मैंने सिर्फ निर्देशक से बात की। यही कारण है कि हम,neutral
6604,8126,क्या हम इस दृश्य को समाप्त कर चुके हैं,surprise
6605,8127,हाँ आप अद्भुत थे।,joy
6606,8128,जैसा तुम थे।,neutral
6607,8129,इसलिए मुझे आपकी कार मिली यह,neutral
6608,8130,क्यों क्या हम दिन के लिए कर रहे हैं,surprise
6609,8131,क्या आपने मुझे बताया,neutral
6610,8133,नहीं हमें मिला आओ यहाँ हम जाते हैं।,fear
6611,8135,इनके बारे में क्या ये वही दिखते हैं,neutral
6612,8136,निश्चित रूप से,joy
6613,8137,एक दूसरे के रूप में नहीं,neutral
6614,8138,ओह फिर नहीं।,neutral
6615,8139,हे,joy
6616,8141,क्या आप तैयार हैं,neutral
6617,8142,हाँ।,neutral
6618,8143,आप अद्भुत लगते हैं। मैं दुनिया में सबसे भाग्यशाली आदमी हूँ।,joy
6619,8144,ओह आप थोड़ा भाग्यशाली होने के बारे में हैं।,joy
6620,8145,मुझे बालियां देखिए।,neutral
6621,8146,ओह शहद बालियां,neutral
6622,8147,वे बहुत अच्छे लगते हैं क्या आपके प्रेमी का सबसे अच्छा स्वाद है,joy
6623,8148,मेरे प्रेमी वास्तव में अच्छा स्वाद है,joy
6624,8149,बालियों को चुनने के लिए धन्यवाद।,neutral
6625,8150,मिमी,neutral
6626,8151,मुझे पता है कि वहाँ कोई छेद नहीं है मुझे वास्तव में उस तस्वीर को पसंद है।,neutral
6627,8152,हे मेरे परमेश्वर इसे देखो,surprise
6628,8153,लेकिन वहाँ,neutral
6629,8154,मैं क्या करता हूँ तार आपके सिर में ढीले हो गए हैं,anger
6630,8155,मैंने सोचा कि अगर मैं तार का पालन कर सकता हूं तो मुझे पता चल सकता है कि यह क्या था।,neutral
6631,8157,नहीं यह उस बेसबोर्ड के पीछे वापस गायब हो जाता है। एक मिनट के लिए मैंने सोचा कि यह डाउनस्टेयर हो गया।,neutral
6632,8158,लेकिन यह नहीं था हाय,neutral
6633,8159,हे मेरे परमेश्वर।,surprise
6634,8160,हैलो प्रिय।,neutral
6635,8161,हैलो श्रीमती Chatracus।,neutral
6636,8162,ओके हर कोई स्पष्ट है हम अब हम सभी की जरूरत है टीमवर्क ठीक है हम,neutral
6637,8163,रॉस मैं वास्तव में क्या सोचते हैं,neutral
6638,8164,लिफ्ट और स्लाइड,joy
6639,8165,यहाँ हम जाते हैं।,neutral
6640,8166,सब ठीक है उठाओ और स्लाइड,joy
6641,8167,सभी सही कार्ल हम आगे हैं। क्या है,neutral
6642,8168,अन्य,neutral
6643,8169,यह सही है क्या आप नहीं करते,neutral
6644,8170,ठीक है मैं,neutral
6645,8171,मेरा मतलब है मुझे एहसास है कि उसकी भावनाओं को पूरी तरह से दूर नहीं जा सकता है लेकिन,sadness
6646,8173,मैं बहुत दुखी हूँ मैं,sadness
6647,8174,गुडबाय मोनिका मैं आपको उसके साथ खुशी का जीवनकाल चाहता हूं।,sadness
6648,8175,चांदलर तुम मुझे बुलाओ जब यह pooper में चला जाता है।,neutral
6649,8176,हाँ,neutral
6650,8177,मैं अपने समान हाथ जुड़वां पाया,joy
6651,8178,ओह,neutral
6652,8179,नहीं,neutral
6653,8180,लेकिन वह अभी यहां आया,surprise
6654,8181,वह जॉय था,neutral
6655,8182,मुझे आश्चर्य है कि वह कहाँ है। यह इतना अजीब है।,neutral
6656,8183,हाँ ठीक है वह शायद रिचर्ड से बात कर रही है।,neutral
6657,8184,क्या आप इसे रोक सकते हैं,anger
6658,8185,क्या आप चाहते हैं कि वह पहली बात है कि वह रिचर्ड के साथ उसके दोपहर के भोजन से वापस आई,neutral
6659,8186,वह उसके लिए कुछ भी महसूस नहीं करती थी।,neutral
6660,8188,वास्तव में,surprise
6661,8190,ओके,neutral
6662,8191,अच्छा मुझे वास्तव में टोपी पहनना शुरू करना चाहिए,neutral
6663,8192,मुझे क्या करना चाहिए,neutral
6664,8193,मेरा मतलब है मैं एक आदमी को घर लाती हूं और पांच मिनट के भीतर वे उस पर हैं।,disgust
6665,8195,सुनो।,neutral
6666,8196,जैसा कि किसी ने बुरा गोमांस के अपने निष्पक्ष हिस्से से अधिक देखा है मैं आपको बताऊंगा यह ऐसी भयानक बात नहीं है।,neutral
6667,8197,मेरा मतलब है वे आपके दोस्त हैं वे सिर्फ तुम्हारे बाद देख रहे हैं।,neutral
6668,8198,मुझे पता है। मैं चाहता हूँ कि एक बार मैं एक आदमी को घर में लाना चाहता हूँ जिसे वे वास्तव में पसंद करते हैं।,sadness
6669,8199,ठीक है अगर वे कभी आदमी से मिलने के लिए नहीं जाते हैं तो आप उस घटना की बाधाओं को महसूस करते हैं।,neutral
6670,8201,वैसे भी मुझे जाना चाहिए। ओके,neutral
6671,8202,हे स्वीटी।,neutral
6672,8203,हाय स्वीटी। तो क्या था,neutral
6673,8204,मैं आपको नहीं बता सकता। यह एक रहस्य है।,neutral
6674,8206,ईमेल लेकिन अभी भी नहीं।,neutral
6675,8207,मैं गंभीर हूँ हम एक दूसरे को बताने चाहिए,neutral
6676,8208,वास्तव में क्यों,neutral
6677,8209,ओह नहीं मैं क्या कर सकता हूँ,fear
6678,8210,यदि आप मुझे बताते हैं तो मैं आपको बता दूँगा कि Phoebe ने क्या कहा है।,neutral
6679,8211,ओके,neutral
6680,8212,ओके,neutral
6681,8213,तो रॉस और मैं के लिए जा रहे हैं,neutral
6682,8214,हे मेरे परमेश्वर। वह फेंकता है,disgust
6683,8215,नहीं उन्होंने फेंकने के दक्षिण में थोड़ा शहर का दौरा किया। तो क्या है,neutral
6684,8216,Oh Phoebe से नैन्सी थॉम्पसन पुराने मालिश स्थान को निकाल दिया जा रहा है।,neutral
6685,8218,यह सही है आप बेकार हो जाते हैं  कृपया मुझसे शादी करो।,joy
6686,8219,अहम ओह अच्छा,joy
6687,8222,मैं तुम्हें जानता हूँ,neutral
6688,8223,आप क्या कर रहे हैं,neutral
6689,8226,अभी तक नहीं। लेकिन ऑडिशन वास्तव में अच्छा हो गया।,joy
6690,8227,इसके लिए क्या था,neutral
6691,8228,ओह यह इन तीन इतालवी भाइयों के बारे में यह बड़ा बजट अवधि फिल्म है जो सदी के अंत में अमेरिका आए।,neutral
6692,8229,यह वास्तव में उत्तम दर्जे का है,joy
6693,8230,ओह और निर्देशक अगले मार्टिन स्कोर्सी होना चाहिए।,joy
6694,8231,अगला,neutral
6695,8232,Yeah वहाँ शिकागो से इस आदमी कौन अगले मार्टिन Scorcese सब ठीक होना चाहिए,neutral
