,Unnamed: 0,Translated_Utterance,Emotion
0,0,मैं भी मेरी कंपनी केएल से जीआर सिस्टम में संक्रमण पर बिंदु व्यक्ति था।,neutral
1,1,क्या आप अपने हाथों को पूरा करना चाहते हैं,neutral
2,2,मैंने किया। मैंने किया।,neutral
3,3,तो चलो अपने कर्तव्यों के बारे में थोड़ा बात करते हैं।,neutral
4,4,मेरे कर्तव्य ठीक है।,surprise
5,5,अब तुम,neutral
6,6,मैं देखता हूँ।,neutral
7,7,लेकिन वहाँ शायद आप के तहत  लोग होंगे तो आप उन पर एक निश्चित राशि डंप कर सकते हैं।,neutral
8,8,जानना अच्छा है।,neutral
9,9,हम विस्तार से जा सकते हैं,neutral
10,10,मैं तुम्हें नहीं जानता,fear
11,11,इसके बाद हम आपको सोमवार को आपके लिए निश्चित जवाब देंगे लेकिन मुझे लगता है कि मैं कुछ विश्वासों के साथ कह सकता हूं आप,neutral
12,12,वास्तव में,surprise
13,13,बिल्कुल। आप आराम कर सकते हैं आपने बहुत अच्छा किया।,neutral
14,14,लेकिन फिर कौन मैं पिछले महीने से बाहर निकल गया,surprise
15,16,नहीं नहीं कौन थे,surprise
16,18,ठीक,neutral
17,19,ठीक है अच्छी तरह से,neutral
18,22,हाँ,neutral
19,23,हे मॉन।,neutral
20,24,हेheyhey। आप कुछ ऐसा सुनना चाहते हैं जो बेकार है।,neutral
21,25,मैं कभी नहीं हूँ।,joy
22,26,क्रिस कहते हैं कि वे बार को बंद कर रहे हैं।,sadness
23,27,नहीं,surprise
24,28,हाँ जाहिरा तौर पर वे इसे किसी तरह के कॉफी स्थान में बदल रहे हैं।,neutral
25,30,मुझे मिला।,sadness
26,31,क्या मुझे बियर मिल सकता है,neutral
27,32,हे क्या आपने रूममेट को चुना,neutral
28,33,You betcha,joy
29,34,क्या यह इतालवी लड़का है,neutral
30,36,हे मेरे परमेश्वर Poor Monica,surprise
31,37,क्या क्या,surprise
32,38,क्या,surprise
33,39,वह उसके साथ थे जब उन्होंने इस कविता को लिखा था।,neutral
34,40,देखो मेरे बर्तन इतना खाली नहीं के साथ अंदर।,neutral
35,41,अब मैं तुम्हें छू गया हूँ तुम अभी भी साम्राज्यवादी लग रहा है। ,neutral
36,42,वह सोचता है कि मोनिका खाली है वह खाली फूलदान है,surprise
37,44,ओह पूरी तरह से। ओह भगवान ओह वह भी बहुत खुश लग रहा था।,sadness
38,45,Done,neutral
39,48,आप यहाँ क्या कर रहे हैं,surprise
40,49,The इमारत मेरे पेपर मार्ग पर है इसलिए मैं ,neutral
41,50,ओह,neutral
42,51,नमस्ते।,neutral
43,52,नमस्ते।,neutral
44,53,कैसे,neutral
45,54,ओह अच्छी तरह से मैंने जिस महिला के साथ साक्षात्कार किया वह बहुत कठिन था लेकिन मैं भगवान मार्क को धन्यवाद देना चाहता हूं क्योंकि एक बार मैंने पतन लाइन के बारे में बात करना शुरू कर दिया उसे सभी खुश हो गया और क्या बंद हो गया।,joy
46,55,मुझे तुम पर गर्व है।,joy
47,56,मुझे भी,joy
48,58,मुझे पता है।,neutral
49,59,हाँ।,neutral
50,60,हाँ।,neutral
51,61,American,neutral
52,62,Americcan,neutral
53,63,American Yknow it,neutral
54,64,हर कोई,surprise
55,65,गुड जॉय अच्छा शीर्ष पायदान,joy
56,66,आप इसे पसंद करते हैं आप वास्तव में इसे पसंद करते हैं,surprise
57,67,ओहहोहो हाँ,joy
58,68,वास्तव में कौन सा भाग,neutral
59,69,पूरी बात क्या हम जा सकते हैं,neutral
60,72,हे क्या के बारे में दृश्य के साथ kangaroo क्या आप उस हिस्से को पसंद करते हैं,neutral
61,74,तुम सो जाओ,anger
62,75,कोई kangaroo नहीं था,anger
63,77,कि,neutral
64,78,मैं आपको बाद में देखता हूँ।,neutral
65,79,क्या,sadness
66,80,मैं,sadness
67,81,मैं,sadness
68,82,देखो,surprise
69,85,उस पर पागल हो जाओ,anger
70,87,ठीक है देखो मुझे लगता है कि हमें राहेल को बताने की जरूरत है।,neutral
71,89,हाँ और यह मेरी इच्छा है कि उस अंगूठी की इच्छा है।,neutral
72,90,देखें अगर मैं उस अंगूठी के साथ दफन नहीं हूं तो मेरी आत्मा सभी अनंत काल के लिए जाल दुनिया को भटकने जा रही है।,neutral
73,91,ठीक है कि पर्याप्त शहद,neutral
74,92,मैं नहीं जानता हूँ। मुझे अंगूठी देखने चलो।,neutral
75,93,महान ठीक है यहाँ।,joy
76,94,ठीक है।,neutral
77,95,धन्यवाद। धन्यवाद। धन्यवाद और,joy
78,96,आप क्या कर रहे हैं,neutral
79,97,ओह आप जानते हैं सामान्य रूप से शिक्षण एरोबिक्स पार्टीिंग रास्ता बहुत ज्यादा।,neutral
80,98,ओह और अगर आप सोच रहे थे तो वे नए जेम्स बॉन्ड पोस्टर पर मेरे पैर हैं।,neutral
81,99,क्या आप एक पल में पकड़ सकते हैं मेरे पास एक और कॉल है। मैं उससे प्यार करता हूँ।,joy
82,100,मुझे पता है।,neutral
83,101,मैं वापस आ गया हूँ।,neutral
84,102,तो क्या हम एक साथ या क्या प्राप्त करते हैं,neutral
85,103,बिल्कुल। The day of the day क्या आप जानते हैं कि उह मध्य पर्क गांव में पांचish,neutral
86,104,मैं आपको फिर से देखता हूँ।,neutral
87,105,ठीक ठीक अंत में एक फोन भुगतान किया गया है।,joy
88,106,हालांकि आप एक अच्छा बॉब इंप्रेशन करते हैं मैं सोच रहा हूँ कि जब वह आपको याद आती है तो वह शायद महसूस करती है हाय आप बॉब नहीं हैं।,neutral
89,107,मैं उम्मीद कर रहा हूँ कि जब बॉब नहीं दिखा रहा है तो वह अगले टेबल पर रोया अजनबी के खुले हथियारों में आराम की तलाश करेगी।,neutral
90,108,हे मेरे देवता। आप शुद्ध बुराई हैं।,disgust
91,110,कोई नहीं,anger
92,111,कोई भी बाल्टी का सम्मान नहीं करता,anger
93,113,देखो,anger
94,114,क्या यह आपके लिए एक कचरा जैसा दिखता है,anger
95,115,नहीं,neutral
96,116,यह मेरी शादी है।,neutral
97,118,ठीक जब हम वापस आते हैं तो आप इसे वीडियो पर देख सकते हैं।,neutral
98,119,यहां आप पाउबे जाते हैं यहाँ आप Phobo जाओ Fewbedo फैबोबो,joy
99,120,धन्यवाद।,neutral
100,121,धन्यवाद।,neutral
101,122,सब ठीक है चलो बाय Feebs,joy
102,123,Bye Pheebs,joy
103,124,लंदन,joy
104,125,क्या आपको ह्यूग की आवश्यकता है मुझे कुछ भी नहीं मिला,joy
105,127,हे इसलिए एस्टेले ने कल मेरे लिए ऑडिशन का एक गुच्छा तैयार किया और मैं अपने स्वास्थ्य बीमा को वापस नहीं लेगा।,joy
106,129,क्या,surprise
107,131,नहीं,neutral
108,132,ठीक है मैं अपने पेट में इस अंधापन दर्द को मिला जब मैं पहले वजन उठा रहा था तो मैं उह से बाहर हो गया और उह क्या हुआ तब से खड़े होने में सक्षम नहीं रहा।,fear
109,133,लेकिन क्या मुझे नहीं लगता,neutral
110,134,यह हर्निया की तरह लगता है। आपके पास क्या है,surprise
111,135,नहीं अगर मुझे डॉक्टर के पास जाना है तो क्या,fear
112,137,मुझे फिर से काम करना क्यों था आप s,anger
113,138,मैं तुम्हारी जगह प्यार करता हूँ यह लड़का कहां से है,joy
114,139,उह कलकत्ता से अठारहवीं सदी के भारतीय कलाकृति।,neutral
115,140,ओह वाह इसलिए आप सिर्फ डायनासोर से अधिक हैं।,surprise
116,141,बहुत कुछ,neutral
117,142,ठीक है अच्छी तरह से योग करने के लिए हम मज़ा कर रहे हैं तुम युवा देखो।,neutral
118,143,ओके,neutral
119,144,लेकिन यह पर्याप्त नहीं है। To make a key to my अपार्टमेंट,neutral
120,145,वास्तव में,surprise
121,146,वास्तव में।,neutral
122,147,आप नहीं सोचते कि यह बहुत तेज है।,neutral
123,148,बाहर जाओ,anger
124,149,रॉस क्या मैं आपसे एक मिनट के लिए बात कर सकता हूं,neutral
125,150,हाँ कृपया तो क्या चल रहा है,neutral
126,151,Uh well जो और मैं टूट गया।,sadness
127,152,क्या हुआ,surprise
128,153,Joey एक महान आदमी है लेकिन हम सिर्फ इतना अलग मेरा मतलब है अपने भाषण के दौरान उन्होंने समलैंगिकता पर हंसते हुए कहा,sadness
129,155,वैसे भी मैं सिर्फ उह मुझे लगता है कि यह सबसे अच्छा है।,sadness
130,156,क्या तुम ठीक हो,neutral
131,157,मुझे लगता है।,sadness
132,158,वहाँ एक और कारण था कि मैंने सोचा कि यह जॉय के साथ समाप्त करने के लिए समय था।,neutral
133,159,मैंने यह महसूस करना शुरू कर दिया कि मुझे किसी और के लिए भावनाओं थी।,neutral
134,160,ओके गेलर सम्मेलन का अंतिम दिन आपको पता है कि कुंजीनोट स्पीकर क्या होता है।,neutral
135,161,ओह प्रोफेसर क्लर्क हम एक बातचीत के बीच में टाइप कर रहे हैं यहां।,neutral
136,162,हाँ क्या आप लोग उसे बाद में पूल में फेंक सकते हैं,neutral
137,164,ठीक है,anger
138,165,कृपया,anger
139,166,क्या हम इसके लिए थोड़ा पुराना नहीं हैं,anger
140,169,सबसे महत्वपूर्ण बात यह है कि आप पहले हमें पकड़ना होगा।,joy
141,170,।,neutral
142,171,जाओ जाओ जाओ,joy
143,172,जाओ जाओ जाओ,joy
144,173,ओह हाँ अब हर कोई इस टोपी के नीचे होना चाहता है,joy
145,175,क्या,surprise
146,176,ओह हाँ बॉब ने कहा कि बाढ़ की क्षति हो सकती है।,neutral
147,177,या तो या उसके पास वास्तव में बड़ी बिल्ली है।,neutral
148,178,ठीक है यह देखते हैं कि अंधा लड़का कहां है मैं बाद में अपने सिर को तोड़ रहा हूँ।,anger
149,179,ओह उम मेरा बड़ा दृश्य आ रहा है। बड़ा दृश्य आया।,joy
150,180,यदि आपने कहा है बिग लीमा बीन bubbling ऊपर। क्या वह अंतर को समझती है,neutral
151,181,Rach आप क्या कर रहे हैं,neutral
152,182,ओह बॉय मैं सिर्फ नहीं देख सकता। यह बहुत डरावना है,fear
153,183,यह एक डायपर वाणिज्यिक है।,neutral
154,184,ओह योआ अच्छी तरह से आप मुझे पता है शिशुओं जिम्मेदारियों आह,fear
155,185,पिज्जा डिलीवरी,joy
156,186,मैं इसे प्राप्त करूँगा मुझे लगता है,joy
157,187,हाय,joy
158,188,हाय,joy
159,189,हे आप खाने या उह के लिए कुछ प्राप्त करना चाहते हैं क्या आप यह देखना चाहते हैं कि हम इस गेंद को वापस कब तक फेंक सकते हैं हुह,neutral
160,190,उह गेंद बात।,neutral
161,191,हाँ,neutral
162,192,हे रॉस यह महान नहीं होगा अगर हम इसे छोड़ने के बिना दो सीधे घंटे जा सकते हैं,joy
163,193,उह,neutral
164,194,नमस्ते,joy
165,195,उहओह,fear
166,196,क्या,neutral
167,198,मैं नहीं सोचा था कि हम इसे बनाना चाहते थे,surprise
168,199,मैं जानता हूँ क्या हाथ स्विच नहीं करते हैं,fear
169,200,हे,neutral
170,201,हे,neutral
171,202,यह कैसे एरिन के साथ जाना था,neutral
172,203,ओह अविश्वसनीय हम सबसे अच्छा समय था,joy
173,204,जय क्या आप अभी नहीं जानते,joy
174,208,तुम लोग बिल्कुल सही थे,joy
175,209,पहली बार जब हम बाहर निकल गए तो यह बहुत बेहतर है।,joy
176,210,क्या,neutral
177,211,यह इतना अजीब था हम वास्तव में तंत्रिका थे।,neutral
178,212,क्या आप एक साथ सो रहे हैं,neutral
179,213,हाँ यह वास्तव में मुझे शांत करता है।,neutral
180,215,हमारे पास बहुत आम है,joy
181,217,हे मेरे परमेश्वर क्या आप बच्चों के बारे में बात करते हैं ओह मेरा जो ओह कृपया मुझे क्या करना चाहिए,surprise
182,218,ओके,neutral
183,219,वह कैसे करती है,surprise
184,220,मैं सार्वजनिक स्थान पर नहीं रह सकता।,neutral
185,222,ओह क्या हाय।,surprise
186,223,यह ठीक है yknow तुम सिर्फ फिर से बंद कर दिया।,neutral
187,224,आपके साथ क्या चल रहा है,surprise
188,225,मुझे नींद नहीं मिली,anger
189,226,क्यों,neutral
190,227,मेरी दादी के पास यह नया प्रेमी है और वे दोनों तरह के बिस्तर में असुरक्षित हैं।,disgust
191,228,ओह और बहरा।,neutral
192,229,इसलिए वे लगातार होते हैं जैसे कि एक दूसरे को आश्वस्त करने के लिए कि उनके पास अच्छा समय है।,neutral
193,230,आपके पास कोई विचार नहीं है कि वे कितनी ज़ोर से हैं,disgust
194,231,ठीक है अगर आप चाहते हैं तो आप राहेल और मुझे रात के साथ रह सकते हैं।,neutral
195,232,धन्यवाद।,joy
196,233,Ew क्या है कुछ विस्फोट,disgust
197,234,यह सिर्फ उसका पानी तोड़ने वाला है। क्या आप नीचे गिर सकते हैं,neutral
198,235,क्या आप जानते हैं क्या है,surprise
199,236,साँस लेना साँस लेना साँस लेना।,neutral
200,237,क्या आप पागल हैं मेरा मतलब है जॉय आपको मारने जा रहा है वह वास्तव में आपको मृत घोषित करने जा रहा है।,surprise
201,239,आप किस तरह जानते हैं,surprise
202,241,मेरा मतलब है यह जीना था,neutral
203,242,Gina कौन है,neutral
204,243,डार्क बड़े बाल हवाई जहाज की बालियां के साथ।,neutral
205,244,नहीं नहीं कि,neutral
206,245,आप देख सकते हैं नहीं बताओ कि कौन क्या है,surprise
207,246,मैं नहीं जानता तुमने सोचा कि आप शनिवार,neutral
208,247,देखो शहद मार्क फैशन ओके में है मुझे एक दोस्त होना पसंद है जो मैं इस सामान को साझा कर सकता हूं।,neutral
209,248,आप कभी मेरे साथ एक व्याख्यान में नहीं जाना चाहते हैं।,neutral
210,249,Pahaa मैं आपसे प्यार करता हूँ।,joy
211,250,वास्तव में,surprise
212,251,Yeah hey II कपड़े है मैं भी उन्हें बाहर लेने के लिए।,neutral
213,252,मेरा मतलब है कि आप सभी जानते हैं कि मैं एक फैशन हो सकता है।,neutral
214,253,ओके मैं तुम्हारे लिए मेरे साथ जाने के लिए प्यार करता हूँ। क्या,joy
215,254,मुझे क्या पहनना चाहिए,fear
216,255,मैं जानता हूँ कि हमने ऐसा किया था  हे,joy
217,256,मुझे पता है यह अद्भुत था मेरा मतलब है हम पूरी तरह से इसे नाखूनित करते हैं यह सुंदर था।,joy
218,257, धन्यवाद सुनो बहुत धन्यवाद Tribbiani धन्यवाद। हे मेरे परमेश्वर उस समय को देखते हुए मुझे बस को गेंद पर पकड़ना पड़ा।,joy
219,259, हाँ।,neutral
220,260,जब तक आप फिर से Foxtrot अभ्यास करना चाहते हैं या फिर टैंगो,neutral
221,261, अहम धन्यवाद लेकिन नहीं। मुझे लगता है मैं मैं लड़कियों के साथ नृत्य करने के लिए तैयार हूँ।,neutral
222,262,ओके,neutral
223,263, हाँ।,neutral
224,264,जाओ जाओ,neutral
225,265, सही हे ahh आप आना चाहते हैं मार्ज एक प्रेमिका है।,neutral
226,266,वास्तव में,surprise
227,267, हाँ आप उसके साथ वास्तविक अच्छा नृत्य कर सकते हैं वह मेरे समान आकार का है।,neutral
228,268,नहीं मैं,neutral
229,270,खैर दुर्भाग्य से मुझे कई कॉलबैक नहीं मिलते हैं,neutral
230,271,क्या यह एक अच्छा संकेत है कि उन्होंने हमें ऑडिशन के बाद लटकाने के लिए कहा,surprise
231,272,कौन जानता है,neutral
232,273,ओके उह हमने इसे रेमंड बेन Kyle और Joey को संकुचित कर दिया है। आप के बाकी बहुत धन्यवाद।,neutral
233,274,हाँ मुझे पता था बाई लंबे समय तक बाद में,joy
234,275,ओह मैं वास्तव में बेन के पिताजी खेलने के लिए हो सकता है,joy
235,276,हाँ,joy
236,277,वास्तव में ऐसा नहीं हो सकता।,neutral
237,278,हाँ क्योंकि आपके पास ऐसा अलग दिखता है हम आपको बेन के साथ रेमंड और किले के साथ डाल रहे हैं।,neutral
238,279,तो तुम दो या दो हो।,neutral
239,281,हाँ यह है।,neutral
240,282,नहीं हम सबसे अच्छे दोस्त हैं यही कारण है कि यह अजीब क्यों है।,neutral
241,284,ठीक है ठीक है ठीक है नमस्ते ठीक है यहाँ कुछ है यहाँ कुछ नीला और नया है।,joy
242,288,और यह तुम सब के कारण अद्भुत अद्भुत तुम,joy
243,289,मुझे लगता है कि तुम क्या हुआ,fear
244,290,नहीं मैं धन्यवाद।,joy
245,291,आपका स्वागत है मैं क्या मैं तुम्हें चोट लगी,fear
246,293,वाह यह बात दिलचस्प थी मुझे नहीं पता कि क्या फीबे और डेविड के साथ होता है।,surprise
